Symbol,Name,Last Sale,Net Change,% Change,Market Cap,Country,IPO Year,Volume,Sector,Industry
QRTEP,Qurate Retail Inc. 8.0% Fixed Rate Cumulative Redeemable Preferred Stock,$82.25,-1.25,-1.497%,0.00,United States,,32259,Consumer Services,Catalog/Specialty Distribution
QRVO,Qorvo Inc. Common Stock,$115.08,-2.86,-2.425%,12478311635.00,United States,,1295733,Capital Goods,Industrial Machinery/Components
QSI,Quantum-Si Incorporated Class A Common Stock,$4.35,-0.44,-9.186%,603317438.00,United States,2020,838227,Health Care,Biotechnology: Pharmaceutical Preparations
QSIAW,Quantum-Si Incorporated Warrant,$0.9568,0.0168,1.787%,0.00,United States,2020,10972,Health Care,Biotechnology: Pharmaceutical Preparations
QTEK,QualTek Services Inc. Class A Common Stock,$2.80,0.10,3.704%,60399592.00,United States,2021,747633,Consumer Services,Telecommunications Equipment
QTEKW,QualTek Services Inc. Warrant,$0.3845,-0.0155,-3.875%,0.00,United States,2021,1395,Consumer Services,Telecommunications Equipment
QTNT,Quotient Limited Ordinary Shares,$1.08,-0.03,-2.703%,110807051.00,Switzerland,2014,339520,Health Care,Biotechnology: In Vitro & In Vivo Diagnostic Substances
QTRX,Quanterix Corporation Common Stock,$29.40,-1.06,-3.48%,1083311796.00,United States,2017,244574,Health Care,Industrial Specialties
QTT,Qutoutiao Inc. American Depositary Shares,$1.66,-0.05,-2.924%,47723631.00,China,2018,80708,Technology,Computer Software: Prepackaged Software
QUBT,Quantum Computing Inc. Common Stock,$2.43,-0.03,-1.22%,70851060.00,United States,,111115,Technology,Computer Manufacturing
QUIK,QuickLogic Corporation Common Stock,$5.34,-0.08,-1.476%,66014864.00,United States,1999,15095,Technology,Semiconductors
QUMU,Qumu Corporation Common Stock,$1.76,-0.03,-1.676%,31296399.00,United States,,10482,Technology,Retail: Computer Software & Peripheral Equipment
QURE,uniQure N.V. Ordinary Shares,$19.26,-0.35,-1.785%,894761512.00,Netherlands,2014,606577,Health Care,Biotechnology: Pharmaceutical Preparations
RACB,Research Alliance Corp. II Class A Common Stock,$9.77,0.00,0.00%,187452105.00,United States,2021,8,Consumer Durables,Consumer Electronics/Appliances
RACY,Relativity Acquisition Corp. Class A Common Stock,$9.97,0.01,0.10%,0.00,,2022,512,,
RACYU,Relativity Acquisition Corp. Unit,$10.14,0.02,0.198%,0.00,,2022,101,Consumer Durables,Consumer Electronics/Appliances
RACYW,Relativity Acquisition Corp. Warrant,$0.17,0.0072,4.423%,0.00,,2022,646805,,
RADA,RADA Electronic Industries Ltd. Ordinary Shares,$14.00,-0.06,-0.427%,608790910.00,Israel,,385932,,
RADI,Radius Global Infrastructure Inc. Class A Common Stock,$13.97,-0.03,-0.214%,1290566300.00,United States,,400201,Consumer Services,Telecommunications Equipment
RAIL,FreightCar America Inc. Common Stock,$5.58,-0.96,-14.679%,91931984.00,United States,2005,415231,Capital Goods,Railroads
RAIN,Rain Therapeutics Inc. Common Stock,$4.82,-0.29,-5.675%,127780162.00,United States,2021,44235,Health Care,Biotechnology: Pharmaceutical Preparations
RAM,Aries I Acquisition Corporation Class A Ordinary Share,$10.06,-0.01,-0.099%,180765625.00,Cayman Islands,2021,7103,Finance,Business Services
RAMMU,Aries I Acquisition Corporation Unit,$10.21,-0.0201,-0.196%,0.00,Cayman Islands,2021,644,Finance,Business Services
RAMMW,Aries I Acquisition Corporation Warrant,$0.3704,-0.0296,-7.40%,0.00,Cayman Islands,2021,3471,Finance,Business Services
RAND,Rand Capital Corporation Common Stock,$15.15,0.00,0.00%,39102468.00,United States,,2823,Finance,Finance/Investors Services
RANI,Rani Therapeutics Holdings Inc. Class A Common Stock,$12.86,-1.29,-9.117%,253529653.00,United States,2021,39217,Consumer Durables,Specialty Chemicals
RAPT,RAPT Therapeutics Inc. Common Stock,$23.48,-0.05,-0.212%,694381507.00,United States,2019,124736,Health Care,Biotechnology: Pharmaceutical Preparations
RARE,Ultragenyx Pharmaceutical Inc. Common Stock,$82.85,2.15,2.664%,5748528526.00,United States,2014,574615,Health Care,Biotechnology: Pharmaceutical Preparations
RAVE,Rave Restaurant Group Inc. Common Stock,$1.12,0.02,1.818%,20165492.00,United States,,474776,Consumer Services,Restaurants
RBB,RBB Bancorp Common Stock,$22.95,-0.09,-0.391%,446467946.00,United States,2017,54959,Finance,Commercial Banks
RBBN,Ribbon Communications Inc. Common Stock,$3.05,-0.03,-0.974%,454319698.00,United States,,305288,Technology,EDP Services
RBCAA,Republic Bancorp Inc. Class A Common Stock,$44.64,-0.35,-0.778%,892554346.00,United States,1998,15324,Finance,Major Banks
RBCN,Rubicon Technology Inc. Common Stock,$8.9947,-0.0053,-0.059%,22006901.00,United States,2007,1717,Technology,Semiconductors
RBKB,Rhinebeck Bancorp Inc. Common Stock,$10.05,-0.0003,-0.003%,113525835.00,United States,2019,226,Finance,Major Banks
RCAC,Revelstone Capital Acquisition Corp. Class A Common Stock,$9.77,0.00,0.00%,201506250.00,United States,2022,3,Consumer Durables,Consumer Electronics/Appliances
RCACU,Revelstone Capital Acquisition Corp. Unit,$9.77,0.00,0.00%,201506250.00,United States,2021,11,Consumer Durables,Consumer Electronics/Appliances
RCACW,Revelstone Capital Acquisition Corp. Warrant,$0.23,0.0044,1.95%,0.00,United States,2022,425,Consumer Durables,Consumer Electronics/Appliances
RCAT,Red Cat Holdings Inc. Common Stock,$2.34,0.03,1.299%,125591448.00,United States,,1304259,Capital Goods,Wholesale Distributors
RCEL,Avita Medical Inc. Common Stock,$8.57,-0.23,-2.614%,213613618.00,United States,,91293,Health Care,Medical Specialities
RCHG,Recharge Acquisition Corp. Class A Common Stock,$9.98,0.005,0.05%,249999000.00,United States,2020,45935,Consumer Durables,Consumer Electronics/Appliances
RCHGU,Recharge Acquisition Corp. Unit,$10.03,-0.02,-0.199%,0.00,United States,2020,4934,Consumer Durables,Consumer Electronics/Appliances
RCHGW,Recharge Acquisition Corp. Warrant,$0.2051,0.0051,2.55%,0.00,United States,2020,5028,Consumer Durables,Consumer Electronics/Appliances
RCII,Rent-A-Center Inc. Common Stock,$24.29,0.41,1.717%,1433808070.00,United States,1995,1926906,Technology,Diversified Commercial Services
RCKT,Rocket Pharmaceuticals Inc. Common Stock,$15.98,-0.53,-3.21%,1030804106.00,United States,2015,261445,Health Care,Biotechnology: Pharmaceutical Preparations
RCKY,Rocky Brands Inc. Common Stock,$40.95,-1.75,-4.098%,299154451.00,United States,1993,30229,Consumer Non-Durables,Shoe Manufacturing
RCLF,Rosecliff Acquisition Corp I Class A Common Stock,$9.7993,0.0293,0.30%,309902863.00,United States,2021,64376,Consumer Durables,Consumer Electronics/Appliances
RCLFU,Rosecliff Acquisition Corp I Unit,$9.80,0.00,0.00%,0.00,United States,2021,302,Consumer Durables,Consumer Electronics/Appliances
RCLFW,Rosecliff Acquisition Corp I Warrants,$0.195,-0.0049,-2.451%,0.00,United States,2021,384,Consumer Durables,Consumer Electronics/Appliances
RCM,R1 RCM Inc. Common Stock,$26.31,0.44,1.701%,7320595430.00,United States,,1287981,Consumer Services,Other Consumer Services
RCMT,RCM Technologies Inc. Common Stock,$12.12,0.35,2.974%,127066274.00,United States,,110553,Consumer Services,Military/Government/Technical
RCON,Recon Technology Ltd. Class A Ordinary Shares,$1.17,-0.02,-1.681%,8427313.00,China,2009,3113883,Energy,Oilfield Services/Equipment
RCRT,Recruiter.com Group Inc. Common Stock,$2.03,0.07,3.571%,29554608.00,United States,,183214,Consumer Services,Interactive Media
RCRTW,Recruiter.com Group Inc. Warrant,$0.6798,0.0298,4.585%,0.00,United States,,23035,Consumer Services,Interactive Media
RDBX,Redbox Entertainment Inc. Class A Common Stock,$2.10,-0.10,-4.545%,26498884.00,United States,2020,292251,Consumer Durables,Consumer Electronics/Appliances
RDBXW,Redbox Entertainment Inc. Warrant,$0.2241,-0.0059,-2.565%,0.00,United States,2020,63952,Consumer Durables,Consumer Electronics/Appliances
RDCM,Radcom Ltd. Ordinary Shares,$12.24,0.01,0.082%,176595256.00,Israel,1997,1845,Technology,Computer peripheral equipment
RDFN,Redfin Corporation Common Stock,$16.18,-0.97,-5.656%,1721497829.00,United States,2017,2762386,Finance,Real Estate
RDHL,Redhill Biopharma Ltd. American Depositary Shares,$2.56,0.04,1.587%,134871626.00,Israel,,152972,Health Care,Biotechnology: Pharmaceutical Preparations
RDI,Reading International Inc Class A Common Stock,$4.24,-0.06,-1.395%,93258639.00,United States,,9472,Consumer Services,Movies/Entertainment
RDIB,Reading International Inc Class B Common Stock,$18.55,-0.04,-0.215%,408006545.00,United States,,1001,Consumer Services,Movies/Entertainment
RDNT,RadNet Inc. Common Stock,$21.30,-0.28,-1.297%,1196712320.00,United States,,180187,Health Care,Medical Specialities
RDUS,Radius Health Inc. Common Stock,$8.97,0.25,2.867%,425023303.00,United States,2014,433031,Health Care,Biotechnology: Pharmaceutical Preparations
RDVT,Red Violet Inc. Common Stock ,$25.94,-1.83,-6.59%,350775388.00,United States,,27609,Technology,Computer Software: Prepackaged Software
RDWR,Radware Ltd. Ordinary Shares,$31.94,-0.58,-1.784%,1469198829.00,Israel,1999,253532,Technology,EDP Services
REAL,The RealReal Inc. Common Stock,$7.25,-0.58,-7.407%,674651563.00,United States,2019,3098435,Consumer Non-Durables,Consumer Specialties
REAX,The Real Brokerage Inc. Common Shares,$2.33,-0.01,-0.427%,415246535.00,Canada,,76869,,
REDU,RISE Education Cayman Ltd American Depositary Shares,$0.812,-0.0093,-1.132%,45864120.00,China,2017,211119,Miscellaneous,Service to the Health Industry
REE,REE Automotive Ltd. Class A Ordinary Shares,$1.99,0.00,0.00%,470905905.00,Israel,,1254840,,
REEAW,REE Automotive Ltd. Warrant,$0.3299,0.0099,3.094%,0.00,Israel,,11707,,
REED,Reeds Inc. Common Stock,$0.2555,-0.0038,-1.465%,28698757.00,United States,,773297,Consumer Non-Durables,Beverages (Production/Distribution)
REFI,Chicago Atlantic Real Estate Finance Inc. Common Stock,$17.51,-0.16,-0.905%,309190057.00,United States,2021,29557,Consumer Services,Real Estate Investment Trusts
REFR,Research Frontiers Incorporated Common Stock,$2.11,0.09,4.455%,66782336.00,United States,,44182,Capital Goods,Industrial Machinery/Components
REG,Regency Centers Corporation Common Stock,$70.64,0.09,0.128%,12105757144.00,United States,1993,977614,Consumer Services,Real Estate Investment Trusts
REGI,Renewable Energy Group Inc. Common Stock,$60.67,0.03,0.049%,3052839958.00,United States,2012,1954001,Basic Industries,Major Chemicals
REGN,Regeneron Pharmaceuticals Inc. Common Stock,$708.36,16.89,2.443%,76884885798.00,United States,1991,683498,Health Care,Biotechnology: Pharmaceutical Preparations
REKR,Rekor Systems Inc. Common Stock,$4.54,-0.36,-7.347%,199656570.00,United States,,601111,Technology,EDP Services
RELI,Reliance Global Group Inc. Common Stock,$4.05,0.00,0.00%,55189354.00,United States,,237682,Finance,Specialty Insurers
RELIW,Reliance Global Group Inc. Series A Warrants,$0.8198,0.0098,1.21%,0.00,United States,,5206,Finance,Specialty Insurers
RELL,Richardson Electronics Ltd. Common Stock,$12.44,0.06,0.485%,168204437.00,United States,1983,109975,Technology,Electronic Components
RELY,Remitly Global Inc. Common Stock,$10.63,-0.43,-3.888%,1765468944.00,United States,2021,956310,Technology,Computer Software: Prepackaged Software
RENO,Renovare Environmental Inc.  Common Stock,$0.5206,-0.0247,-4.53%,17061526.00,United States,,123856,Capital Goods,Industrial Machinery/Components
RENT,Rent the Runway Inc. Class A Common Stock,$5.68,-0.59,-9.41%,358045928.00,United States,2021,1522969,Consumer Non-Durables,Department/Specialty Retail Stores
REPL,Replimune Group Inc. Common Stock,$19.97,0.30,1.525%,942774614.00,United States,2018,275170,Health Care,Biotechnology: Pharmaceutical Preparations
RETA,Reata Pharmaceuticals Inc. Class A Common Stock,$35.65,-0.23,-0.641%,1297799712.00,United States,2016,670130,Health Care,Biotechnology: Pharmaceutical Preparations
RETO,ReTo Eco-Solutions Inc. Common Shares,$1.05,-0.04,-3.67%,32059768.00,China,2017,191774,Capital Goods,Multi-Sector Companies
REVB,Revelation Biosciences Inc. Common Stock,$1.10,-0.01,-0.901%,15661073.00,United States,2020,371392,Health Care,Biotechnology: Pharmaceutical Preparations
REVBU,Revelation Biosciences Inc. Unit,$10.01,0.00,0.00%,0.00,United States,2020,10,Health Care,Biotechnology: Pharmaceutical Preparations
REVBW,Revelation Biosciences Inc. Warrant,$0.1265,0.0001,0.079%,0.00,United States,2020,49776,Health Care,Biotechnology: Pharmaceutical Preparations
REVE,Alpine Acquisition Corporation Common Stock,$10.11,0.02,0.198%,137243250.00,United States,2021,784,Consumer Durables,Consumer Electronics/Appliances
REVEW,Alpine Acquisition Corporation Warrant,$0.18,0.0001,0.056%,0.00,United States,2021,600,Consumer Durables,Consumer Electronics/Appliances
REVH,Revolution Healthcare Acquisition Corp. SAIL Class A Common Stock,$9.7843,0.0043,0.044%,565043325.00,United States,2021,7175,Consumer Durables,Consumer Electronics/Appliances
REVHU,Revolution Healthcare Acquisition Corp. SAIL Units,$9.8651,0.0451,0.459%,0.00,United States,2021,365,Consumer Durables,Consumer Electronics/Appliances
REVHW,Revolution Healthcare Acquisition Corp. SAIL Warrant.,$0.4999,-0.0101,-1.98%,0.00,United States,2021,800,Consumer Durables,Consumer Electronics/Appliances
REYN,Reynolds Consumer Products Inc. Common Stock,$29.48,-0.42,-1.405%,6185681948.00,United States,2020,305704,Capital Goods,Office Equipment/Supplies/Services
RFACU,RF Acquisition Corp. Unit,$10.06,0.00,0.00%,0.00,Singapore,2022,42,Consumer Durables,Consumer Electronics/Appliances
RFIL,RF Industries Ltd. Common Stock,$7.22,0.15,2.122%,72894384.00,United States,,6404,Capital Goods,Electrical Products
RGC,Regencell Bioscience Holdings Limited Ordinary Shares,$20.67,-1.88,-8.337%,268030060.00,Hong Kong,2021,6149,,
RGCO,RGC Resources Inc. Common Stock,$21.75,0.37,1.731%,208514966.00,United States,,10713,Public Utilities,Oil & Gas Production
RGEN,Repligen Corporation Common Stock,$177.96,-4.10,-2.252%,9846077451.00,United States,1986,378846,Health Care,Medical/Dental Instruments
RGF,The Real Good Food Company Inc. Class A Common Stock,$8.00,-0.09,-1.112%,205980528.00,United States,2021,15068,Consumer Non-Durables,Food Distributors
RGLD,Royal Gold Inc. Common Stock,$143.16,1.19,0.838%,9394045101.00,United States,,533490,Consumer Durables,Consumer Electronics/Appliances
RGLS,Regulus Therapeutics Inc. Common Stock,$0.31,0.003,0.977%,45251067.00,United States,2012,326755,Health Care,Biotechnology: Pharmaceutical Preparations
RGNX,REGENXBIO Inc. Common Stock,$33.78,-0.59,-1.717%,1450836204.00,United States,2015,281393,Health Care,Biotechnology: Biological Products (No Diagnostic Substances)
RGP,Resources Connection Inc. Common Stock,$16.90,0.06,0.356%,549709849.00,United States,,194923,Miscellaneous,Business Services
RGTI,Rigetti Computing Inc. Common Stock,$5.83,-0.13,-2.181%,663513962.00,United States,,415217,Technology,Retail: Computer Software & Peripheral Equipment
RGTIW,Rigetti Computing Inc. Warrants,$1.15,-0.0799,-6.496%,0.00,United States,,26069,Technology,Retail: Computer Software & Peripheral Equipment
RIBT,RiceBran Technologies Common Stock,$0.4351,0.0124,2.934%,22544456.00,United States,,1136056,Consumer Non-Durables,Specialty Foods
RICK,RCI Hospitality Holdings Inc. Common Stock,$58.65,-1.55,-2.575%,557169722.00,United States,1995,62925,Consumer Services,Restaurants
RICO,Agrico Acquisition Corp. Class A Ordinary Shares,$10.17,0.05,0.494%,182996438.00,Cayman Islands,2021,1409,,
RICOU,Agrico Acquisition Corp. Unit,$10.30,0.00,0.00%,0.00,Cayman Islands,2021,90,,
RICOW,Agrico Acquisition Corp. Warrant,$0.2169,0.0095,4.581%,0.00,Cayman Islands,2021,4428,,
RIDE,Lordstown Motors Corp. Class A Common Stock,$3.155,-0.225,-6.657%,619871315.00,United States,2019,4617660,Capital Goods,Construction/Ag Equipment/Trucks
RIGL,Rigel Pharmaceuticals Inc. Common Stock,$3.14,0.05,1.618%,539086331.00,United States,2000,1182016,Health Care,Biotechnology: Pharmaceutical Preparations
RILY,B. Riley Financial Inc. Common Stock,$62.07,-5.67,-8.37%,1723782281.00,United States,,364032,Finance,Investment Managers
RILYG,B. Riley Financial Inc. 5.00% Senior Notes due 2026,$23.91,-0.0391,-0.163%,0.00,United States,,17768,Miscellaneous,Business Services
RILYK,B. Riley Financial Inc. 5.50% Senior Notes Due 2026,$24.96,-0.04,-0.16%,0.00,United States,,4964,Miscellaneous,Business Services
RILYL,B. Riley Financial Inc. Depositary Shares each representing 1/1000th in a share of 7.375% Series B Cumulative Perpetual Preferred Stock par value $0.0001,$26.40,0.10,0.38%,0.00,United States,,6057,Finance,Investment Managers
RILYM,B. Riley Financial Inc. 6.375% Senior Notes due 2025,$25.26,-0.17,-0.669%,0.00,United States,,10092,Miscellaneous,Business Services
RILYN,B. Riley Financial Inc. 6.50% Senior Notes Due 2026,$25.39,-0.069,-0.271%,0.00,United States,,7924,Miscellaneous,Business Services
RILYO,B. Riley Financial Inc. 6.75% Senior Notes due 2024,$25.53,-0.02,-0.078%,0.00,United States,,8188,Miscellaneous,Business Services
RILYP,B. Riley Financial Inc. Depositary Shares each representing a 1/1000th fractional interest in a share of Series A Cumulative Perpetual Preferred Stock,$26.0965,0.0265,0.102%,0.00,United States,,1648,Finance,Investment Managers
RILYT,B. Riley Financial Inc. 6.00% Senior Notes Due 2028,$25.04,-0.10,-0.398%,0.00,United States,,14694,Miscellaneous,Business Services
RILYZ,B. Riley Financial Inc. 5.25% Senior Notes due 2028,$23.72,-0.255,-1.064%,0.00,United States,,14644,Miscellaneous,Business Services
RIOT,Riot Blockchain Inc.  Common Stock ,$17.66,-1.57,-8.164%,2071594009.00,United States,,9182994,Technology,Retail: Computer Software & Peripheral Equipment
RIVN,Rivian Automotive Inc. Class A Common Stock,$40.10,-2.09,-4.954%,36102726056.00,United States,2021,22179640,Capital Goods,Auto Manufacturing
RKDA,Arcadia Biosciences Inc. Common Stock,$1.40,-0.05,-3.448%,31057929.00,United States,2015,507542,Basic Industries,Agricultural Chemicals
RKLB,Rocket Lab USA Inc. Common Stock,$8.06,-0.14,-1.707%,3746098646.00,United States,2020,4170124,Capital Goods,Aerospace
RLAY,Relay Therapeutics Inc. Common Stock,$31.64,-0.20,-0.628%,3425980592.00,United States,2020,504193,Health Care,Biotechnology: Pharmaceutical Preparations
RLMD,Relmada Therapeutics Inc. Common Stock,$30.34,0.52,1.744%,891070327.00,United States,,300925,Health Care,Biotechnology: Pharmaceutical Preparations
RLYB,Rallybio Corporation Common Stock,$8.03,0.24,3.081%,258011689.00,United States,2021,101238,Health Care,Biotechnology: Pharmaceutical Preparations
RMBI,Richmond Mutual Bancorporation Inc. Common Stock,$16.87,-0.13,-0.765%,207711369.00,United States,2019,4886,,
RMBL,RumbleOn Inc. Class B Common Stock,$31.10,-1.37,-4.219%,497001014.00,United States,,79703,Capital Goods,Automotive Aftermarket
RMBS,Rambus Inc. Common Stock,$27.48,-1.14,-3.983%,3027674787.00,United States,1997,1298336,Technology,Semiconductors
RMCF,Rocky Mountain Chocolate Factory Inc. Common Stock,$7.10,-0.10,-1.389%,43876864.00,United States,,3220,Consumer Non-Durables,Specialty Foods
RMGC,RMG Acquisition Corp. III Class A Ordinary Shares,$9.81,0.02,0.204%,592278750.00,United States,2021,1014,Finance,Business Services
RMGCU,RMG Acquisition Corp. III Unit,$9.88,0.00,0.00%,0.00,United States,2021,500,Finance,Business Services
RMGCW,RMG Acquisition Corp. III Warrant,$0.4106,-0.0394,-8.756%,0.00,United States,2021,587,Finance,Business Services
RMNI,Rimini Street Inc. (DE) Common Stock,$6.06,-0.02,-0.329%,529304640.00,United States,2015,527757,Technology,EDP Services
RMR,The RMR Group Inc. Class A Common Stock,$30.09,-0.27,-0.889%,496033981.00,United States,,49463,Finance,Real Estate
RMTI,Rockwell Medical Inc. (DE) Common Stock,$0.4042,-0.0118,-2.837%,37981211.00,United States,1998,323530,Health Care,Biotechnology: Pharmaceutical Preparations
RNA,Avidity Biosciences Inc. Common Stock,$20.00,0.11,0.553%,955093540.00,United States,2020,181460,Health Care,Biotechnology: Pharmaceutical Preparations
RNAZ,TransCode Therapeutics Inc. Common Stock,$2.83,-0.07,-2.414%,36519944.00,United States,2021,12976,Health Care,Biotechnology: Pharmaceutical Preparations
RNDB,Randolph Bancorp Inc. Common Stock,$26.36,-0.02,-0.076%,136562461.00,United States,2016,67370,Finance,Major Banks
RNER,Mount Rainier Acquisition Corp. Common Stock,$9.99,-0.02,-0.20%,221365413.00,United States,2022,81304,Consumer Durables,Consumer Electronics/Appliances
RNERW,Mount Rainier Acquisition Corp. Warrant,$0.2269,0.001,0.443%,0.00,United States,2022,70774,Consumer Durables,Consumer Electronics/Appliances
RNLX,Renalytix plc American Depositary Shares,$6.65,0.06,0.91%,240427192.00,United Kingdom,2020,112949,Health Care,Medical Specialities
RNST,Renasant Corporation Common Stock,$32.36,-0.45,-1.372%,1806178319.00,United States,,272342,Finance,Major Banks
RNW,ReNew Energy Global plc Class A Ordinary Shares,$8.06,-0.15,-1.827%,3230441923.00,United Kingdom,,1324881,,
RNWK,RealNetworks Inc. Common Stock,$0.5602,-0.0158,-2.743%,26473185.00,United States,1997,143341,Technology,EDP Services
RNWWW,ReNew Energy Global plc Warrant,$1.82,-0.01,-0.546%,0.00,United Kingdom,,143235,,
RNXT,RenovoRx Inc. Common Stock,$2.88,-0.05,-1.706%,25655472.00,United States,2021,22836,Health Care,Biotechnology: Pharmaceutical Preparations
ROAD,Construction Partners Inc. Class A Common Stock,$26.18,-0.37,-1.394%,1375626896.00,United States,2018,252574,Capital Goods,Engineering & Construction
ROC,ROC Energy Acquisition Corp. Common Stock,$9.93,-0.02,-0.201%,266630430.00,United States,2021,205,Consumer Durables,Consumer Electronics/Appliances
ROCAR,ROC Energy Acquisition Corp. Rights,$0.19,-0.0065,-3.308%,0.00,United States,2021,21162,Consumer Durables,Consumer Electronics/Appliances
ROCAU,ROC Energy Acquisition Corp. Unit,$10.00,-0.14,-1.381%,0.00,United States,2021,1697,Consumer Durables,Consumer Electronics/Appliances
ROCC,Ranger Oil Corporation Class A Common Stock,$34.53,-0.87,-2.458%,729111102.00,United States,,449256,Energy,Oil & Gas Production
ROCG,Roth CH Acquisition IV Co. Common Stock,$9.94,0.00,0.00%,147474810.00,United States,2021,10193,Consumer Durables,Consumer Electronics/Appliances
ROCGU,Roth CH Acquisition IV Co. Unit,$10.04,0.01,0.10%,0.00,United States,2021,31002,Consumer Durables,Consumer Electronics/Appliances
ROCGW,Roth CH Acquisition IV Co. Warrant,$0.334,0.0049,1.489%,0.00,United States,2021,3299,Consumer Durables,Consumer Electronics/Appliances
ROCK,Gibraltar Industries Inc. Common Stock,$41.11,-1.34,-3.157%,1344268059.00,United States,1993,281532,,
ROCL,Roth CH Acquisition V Co. Common Stock,$9.85,-0.02,-0.203%,0.00,United States,2022,57620,Consumer Durables,Consumer Electronics/Appliances
ROCLU,Roth CH Acquisition V Co. Unit,$10.05,0.06,0.601%,0.00,United States,2021,30263,Consumer Durables,Consumer Electronics/Appliances
ROCLW,Roth CH Acquisition V Co. Warrant,$0.3296,-0.0703,-17.579%,0.00,United States,2022,12584,Consumer Durables,Consumer Electronics/Appliances
ROIC,Retail Opportunity Investments Corp. Common Stock (MD),$19.24,0.02,0.104%,2369098314.00,United States,,1119185,Consumer Services,Real Estate Investment Trusts
ROIV,Roivant Sciences Ltd. Common Shares,$4.15,-0.13,-3.037%,2872099564.00,United Kingdom,,619207,,
ROIVW,Roivant Sciences Ltd. Warrant,$0.7118,-0.037,-4.941%,0.00,United Kingdom,,3241,,
ROKU,Roku Inc. Class A Common Stock,$119.33,-8.04,-6.312%,16145619521.00,United States,2017,6364458,Consumer Services,Television Services
ROLL,RBC Bearings Incorporated Common Stock,$180.88,-6.21,-3.319%,5223155816.00,United States,2005,227564,Capital Goods,Metal Fabrications
ROLLP,RBC Bearings Incorporated 5.00% Series A Mandatory Convertible Preferred Stock,$95.00,-2.2999,-2.364%,0.00,United States,,116831,Capital Goods,Metal Fabrications
ROOT,Root Inc. Class A Common Stock,$1.88,-0.07,-3.59%,477520000.00,United States,2020,2145529,Finance,Property-Casualty Insurers
ROSE,Rose Hill Acquisition Corporation Class A Ordinary Shares,$10.02,-0.01,-0.10%,194450625.00,United States,2021,1217,,
ROSEU,Rose Hill Acquisition Corporation Unit,$10.13,0.06,0.596%,0.00,United States,2021,4549,,
ROSEW,Rose Hill Acquisition Corporation Warrant,$0.258,-0.0019,-0.731%,0.00,United States,2021,1700,,
ROST,Ross Stores Inc. Common Stock,$94.19,1.04,1.116%,33050562126.00,United States,1985,3356715,Consumer Services,Clothing/Shoe/Accessory Stores
ROVR,Rover Group Inc. Class A Common Stock,$5.50,-0.12,-2.135%,991438910.00,United States,2021,454484,Miscellaneous,Other Consumer Services
RPAY,Repay Holdings Corporation Class A Common Stock,$14.80,-0.08,-0.538%,1310550330.00,United States,2018,482744,Technology,EDP Services
RPD,Rapid7 Inc. Common Stock,$107.44,-4.30,-3.848%,6239958660.00,United States,2015,689044,Technology,Computer Software: Prepackaged Software
RPHM,Reneo Pharmaceuticals Inc. Common Stock,$2.77,-0.11,-3.819%,67750184.00,United States,2021,62271,Health Care,Biotechnology: Pharmaceutical Preparations
RPID,Rapid Micro Biosystems Inc. Class A Common Stock,$6.06,-0.33,-5.164%,254158382.00,United States,2021,66955,Health Care,Medical Specialities
RPRX,Royalty Pharma plc Class A Ordinary Shares ,$40.38,0.54,1.355%,17553412047.00,United States,2020,2931727,Health Care,Biotechnology: Pharmaceutical Preparations
RPTX,Repare Therapeutics Inc. Common Shares,$14.13,-0.10,-0.703%,591656574.00,Canada,2020,125356,,
RRBI,Red River Bancshares Inc. Common Stock,$52.57,-0.53,-0.998%,377496233.00,United States,2019,5375,Finance,Commercial Banks
RRGB,Red Robin Gourmet Burgers Inc. Common Stock,$14.75,-0.75,-4.839%,232277321.00,United States,2002,287938,Consumer Services,Restaurants
RRR,Red Rock Resorts Inc. Class A Common Stock,$44.09,-3.92,-8.165%,2701396901.00,United States,2016,1184708,Consumer Services,Recreational Products/Toys
RSLS,ReShape Lifesciences Inc. Common Stock,$1.20,0.02,1.695%,21340832.00,United States,2016,80229,Health Care,Biotechnology: Electromedical & Electrotherapeutic Apparatus
