Symbol,Name,Last Sale,Net Change,% Change,Market Cap,Country,IPO Year,Volume,Sector,Industry
IRTC,iRhythm Technologies Inc. Common Stock,$152.98,-7.28,-4.543%,4514939127.00,United States,2016,578913,Health Care,Medical/Dental Instruments
IRWD,Ironwood Pharmaceuticals Inc. Class A Common Stock,$12.44,-0.03,-0.241%,1980721294.00,United States,2010,1689851,Health Care,Biotechnology: Pharmaceutical Preparations
ISAA,Iron Spark I Inc. Class A Common Stock,$10.11,-0.03,-0.296%,222832488.00,United States,2021,205339,Finance,Business Services
ISBC,Investors Bancorp Inc. Common Stock,$13.87,-0.35,-2.461%,3454167157.00,United States,,133014308,Finance,Savings Institutions
ISEE,IVERIC bio Inc. Common Stock,$18.29,0.00,0.00%,2116767690.00,United States,2013,1844276,Health Care,Biotechnology: Pharmaceutical Preparations
ISIG,Insignia Systems Inc. Common Stock,$9.42,-0.41,-4.171%,16826908.00,United States,1991,201206,Technology,Advertising
ISLE,Isleworth Healthcare Acquisition Corporation Common stock,$9.90,0.00,0.00%,259293375.00,United States,2021,5130,Consumer Durables,Consumer Electronics/Appliances
ISLEW,Isleworth Healthcare Acquisition Corporation Warrant,$0.136,-0.0314,-18.757%,0.00,United States,2021,1310,Consumer Durables,Consumer Electronics/Appliances
ISO,IsoPlexis Corporation Common Stock,$3.01,-0.19,-5.938%,117504136.00,United States,2021,102468,Health Care,Biotechnology: Electromedical & Electrotherapeutic Apparatus
ISPC,iSpecimen Inc. Common Stock,$4.23,0.04,0.955%,37141189.00,United States,2021,339480,Health Care,Precision Instruments
ISPO,Inspirato Incorporated Class A Common Stock,$8.17,-0.62,-7.053%,383433500.00,United States,2021,2118329,Consumer Services,Hotels/Resorts
ISPOW,Inspirato Incorporated Warrant,$1.555,-0.175,-10.116%,0.00,United States,2021,89832,Consumer Services,Hotels/Resorts
ISRG,Intuitive Surgical Inc. Common Stock,$288.67,-7.25,-2.45%,103688773597.00,United States,2000,1939573,Health Care,Medical/Dental Instruments
ISSC,Innovative Solutions and Support Inc. Common Stock,$8.05,-0.01,-0.124%,139037732.00,United States,2000,9683,Capital Goods,Military/Government/Technical
ISTR,Investar Holding Corporation Common Stock,$18.80,-0.09,-0.476%,193831986.00,United States,2014,14531,Finance,Commercial Banks
ISUN,iSun Inc. Common Stock,$4.00,-0.09,-2.20%,53565152.00,United States,2016,253627,Technology,Semiconductors
ITAQ,Industrial Tech Acquisitions II Inc. Class A Common Stock,$9.95,0.01,0.101%,0.00,United States,2022,800,Consumer Durables,Consumer Electronics/Appliances
ITAQU,Industrial Tech Acquisitions II Inc. Unit,$10.06,0.00,0.00%,0.00,United States,2022,20,Consumer Durables,Consumer Electronics/Appliances
ITAQW,Industrial Tech Acquisitions II Inc. Warrants,$0.26,0.00,0.00%,0.00,United States,2022,106,Consumer Durables,Consumer Electronics/Appliances
ITCI,Intra-Cellular Therapies Inc. Common Stock,$65.64,2.43,3.844%,6143493619.00,United States,,851089,Health Care,Biotechnology: Pharmaceutical Preparations
ITHX,ITHAX Acquisition Corp. Class A Ordinary Shares,$9.845,0.005,0.051%,303841313.00,United States,2021,25517,Finance,Business Services
ITHXU,ITHAX Acquisition Corp. Unit,$9.98,-0.015,-0.15%,0.00,United States,2021,150,Finance,Business Services
ITHXW,ITHAX Acquisition Corp. Warrant,$0.3151,-0.0196,-5.856%,0.00,United States,2021,299,Finance,Business Services
ITI,Iteris Inc. Common Stock,$2.90,-0.04,-1.361%,122991271.00,United States,,190844,Capital Goods,Telecommunications Equipment
ITIC,Investors Title Company Common Stock,$196.00,-7.13,-3.51%,371708120.00,United States,,4564,Finance,Specialty Insurers
ITOS,iTeos Therapeutics Inc. Common Stock,$34.53,0.03,0.087%,1226319587.00,United States,2020,393943,Consumer Durables,Specialty Chemicals
ITQ,Itiquira Acquisition Corp. Class A Ordinary Shares,$9.80,0.00,0.00%,281750000.00,United States,2021,2875,Finance,Business Services
ITQRU,Itiquira Acquisition Corp. Unit,$9.95,0.01,0.101%,0.00,United States,2021,13329,Finance,Business Services
ITQRW,Itiquira Acquisition Corp. Warrant,$0.301,0.001,0.333%,0.00,United States,2021,1600,Finance,Business Services
ITRI,Itron Inc. Common Stock,$51.54,-0.61,-1.17%,2321210588.00,United States,1993,293396,Capital Goods,Electrical Products
ITRM,Iterum Therapeutics plc Ordinary Share,$0.3271,-0.0154,-4.496%,59785795.00,Ireland,2018,1259127,Health Care,Biotechnology: Pharmaceutical Preparations
ITRN,Ituran Location and Control Ltd. Ordinary Shares,$24.11,0.19,0.794%,498773045.00,Israel,2005,25387,Technology,Electronic Components
IVA,Inventiva S.A. American Depository Shares,$11.25,-0.9021,-7.423%,459827449.00,France,2020,11577,Consumer Services,Other Consumer Services
IVAC,Intevac Inc. Common Stock,$5.30,-0.20,-3.636%,131704035.00,United States,1995,73117,,
IVCB,Investcorp Europe Acquisition Corp I Class A Ordinary Shares,$9.98,0.00,0.00%,430387500.00,Cayman Islands,2022,11,,
IVCBU,Investcorp Europe Acquisition Corp I Unit,$10.07,0.00,0.00%,0.00,Cayman Islands,2021,70,,
IVCBW,Investcorp Europe Acquisition Corp I Warrant,$0.30,0.00,0.00%,0.00,Cayman Islands,2022,36236,,
IVCP,Swiftmerge Acquisition Corp. Class A Ordinary Share,$9.81,-0.01,-0.102%,277132500.00,Canada,2022,125035,,
IVCPU,Swiftmerge Acquisition Corp. Unit,$9.95,0.02,0.201%,0.00,Canada,2021,2322,,
IVCPW,Swiftmerge Acquisition Corp. Warrants,$0.32,0.0202,6.738%,0.00,Canada,2022,1113,,
IVDA,Iveda Solutions Inc. Common Stock,$3.03,-0.03,-0.98%,29295155.00,United States,,6682685,Capital Goods,Homebuilding
IVDAW,Iveda Solutions Inc. Warrant,$0.71,-0.04,-5.333%,0.00,United States,,59285,Miscellaneous,Diversified Manufacture
IXAQ,IX Acquisition Corp. Class A Ordinary Share,$9.83,0.02,0.204%,282612500.00,United Kingdom,2021,24000,,
IXAQU,IX Acquisition Corp. Unit,$9.89,0.03,0.304%,0.00,United Kingdom,2021,146,,
IXHL,Incannex Healthcare Limited American Depositary Shares,$8.92,-0.21,-2.30%,431862870.00,Australia,,83245,,
IZEA,IZEA Worldwide Inc. Common Stock,$1.43,-0.12,-7.742%,88660000.00,United States,,1404504,Technology,Advertising
JACK,Jack In The Box Inc. Common Stock,$89.59,-2.20,-2.397%,1885287075.00,United States,,375235,Consumer Services,Restaurants
JAGX,Jaguar Health Inc. Common Stock,$0.6021,-0.0554,-8.426%,46394207.00,United States,2015,3178227,Health Care,Biotechnology: Pharmaceutical Preparations
JAKK,JAKKS Pacific Inc. Common Stock,$13.26,0.36,2.791%,126896914.00,United States,1996,112613,Consumer Non-Durables,Recreational Products/Toys
JAMF,Jamf Holding Corp. Common Stock,$34.05,-0.37,-1.075%,4071814634.00,United States,2020,486761,Technology,Computer Software: Prepackaged Software
JAN,JanOne Inc. Common Stock (NV),$3.20,-0.22,-6.433%,9047712.00,United States,,40518,Public Utilities,Environmental Services
JANX,Janux Therapeutics Inc. Common Stock,$14.41,-0.63,-4.189%,599786882.00,United States,2021,28583,Health Care,Biotechnology: Pharmaceutical Preparations
JAQC,Jupiter Acquisition Corporation Common stock,$9.68,0.035,0.363%,196480274.00,United States,2021,55725,Consumer Durables,Consumer Electronics/Appliances
JAQCU,Jupiter Acquisition Corporation Units,$9.81,0.03,0.307%,0.00,United States,2021,100,Consumer Durables,Consumer Electronics/Appliances
JAQCW,Jupiter Acquisition Corporation Warrants,$0.33,0.00,0.00%,0.00,United States,2021,1600,Consumer Durables,Consumer Electronics/Appliances
JAZZ,Jazz Pharmaceuticals plc Common Stock (Ireland),$163.27,0.39,0.239%,10080100570.00,Ireland,2007,924008,Health Care,Biotechnology: Pharmaceutical Preparations
JBHT,J.B. Hunt Transport Services Inc. Common Stock,$170.71,-2.37,-1.369%,17899022709.00,United States,,2084666,Transportation,Trucking Freight/Courier Services
JBLU,JetBlue Airways Corporation Common Stock,$12.45,-1.19,-8.724%,3986379892.00,United States,2002,35277558,Transportation,Air Freight/Delivery Services
JBSS,John B. Sanfilippo & Son Inc. Common Stock,$85.54,0.36,0.423%,985912484.00,United States,1991,49676,Consumer Non-Durables,Specialty Foods
JCIC,Jack Creek Investment Corp. Class A Ordinary Shares,$9.81,0.00,0.00%,423056250.00,United States,2021,493,Finance,Business Services
JCICU,Jack Creek Investment Corp. Units,$9.88,-0.03,-0.303%,0.00,United States,2021,120,Finance,Business Services
JCICW,Jack Creek Investment Corp. Warrants,$0.215,-0.005,-2.273%,0.00,United States,2021,3316,Finance,Business Services
JCTCF,Jewett-Cameron Trading Company Common Shares,$6.37,-0.1661,-2.541%,22249404.00,United States,,682,,
JD,JD.com Inc. American Depositary Shares,$59.07,-1.85,-3.037%,92114707137.00,China,2014,9028145,Miscellaneous,Diversified Commercial Services
JFIN,Jiayin Group Inc. American Depositary Shares,$2.32,-0.25,-9.728%,125338000.00,China,2019,77650,Finance,Finance: Consumer Services
JFU,9F Inc. American Depositary Shares,$0.9382,-0.0068,-0.72%,217027872.00,China,2019,28001,Finance,Finance: Consumer Services
JG,Aurora Mobile Limited American Depositary Shares,$1.12,-0.02,-1.754%,132636849.00,China,2018,47432,Technology,EDP Services
JGGC,Jaguar Global Growth Corporation I Class A Ordinary Shares,$9.87,0.0065,0.066%,0.00,United States,2022,166951,,
JGGCR,Jaguar Global Growth Corporation I Right,$0.17,0.02,13.333%,0.00,United States,2022,100000,,
JGGCU,Jaguar Global Growth Corporation I Unit,$10.11,0.04,0.397%,0.00,United States,2022,124443,,
JGGCW,Jaguar Global Growth Corporation I Warrant,$0.16,0.00,0.00%,0.00,United States,2022,75000,,
JJSF,J & J Snack Foods Corp. Common Stock,$152.75,-0.02,-0.013%,2919001634.00,United States,1986,62166,Consumer Non-Durables,Specialty Foods
JKHY,Jack Henry & Associates Inc. Common Stock,$203.72,-0.03,-0.015%,14835915723.00,United States,1985,581010,Technology,Retail: Computer Software & Peripheral Equipment
JMAC,Maxpro Capital Acquisition Corp. Class A Common Stock,$10.01,0.01,0.10%,134409525.00,Taiwan,2021,331798,Consumer Durables,Consumer Electronics/Appliances
JMACU,Maxpro Capital Acquisition Corp. Units,$10.14,0.00,0.00%,0.00,Taiwan,2021,615,Consumer Durables,Consumer Electronics/Appliances
JMACW,Maxpro Capital Acquisition Corp. Warrants,$0.216,-0.004,-1.818%,0.00,Taiwan,2021,2700,Consumer Durables,Consumer Electronics/Appliances
JNCE,Jounce Therapeutics Inc. Common Stock,$7.61,-0.04,-0.523%,393168276.00,United States,2017,149762,Health Care,Biotechnology: Pharmaceutical Preparations
JOAN,JOANN Inc. Common Stock,$10.95,-0.33,-2.926%,444506370.00,United States,2021,317575,Consumer Non-Durables,Department/Specialty Retail Stores
JOBS,51job Inc. American Depositary Shares,$60.56,0.13,0.215%,4083997377.00,China,2004,2490743,Technology,Diversified Commercial Services
JOFF,JOFF Fintech Acquisition Corp. Class A Common Stock,$9.79,0.01,0.102%,506632500.00,United States,2021,8950,Consumer Durables,Consumer Electronics/Appliances
JOFFU,JOFF Fintech Acquisition Corp. Unit,$9.87,-0.0103,-0.104%,0.00,United States,2021,1187,Consumer Durables,Consumer Electronics/Appliances
JOFFW,JOFF Fintech Acquisition Corp. Warrant,$0.26,-0.0132,-4.832%,0.00,United States,2021,534,Consumer Durables,Consumer Electronics/Appliances
JOUT,Johnson Outdoors Inc. Class A Common Stock,$76.38,-0.48,-0.625%,775795097.00,United States,,41153,Consumer Non-Durables,Recreational Products/Toys
JRSH,Jerash Holdings (US) Inc. Common Stock,$6.24,-0.14,-2.194%,76966144.00,United States,2018,18711,Basic Industries,Industrial Specialties
JRVR,James River Group Holdings Ltd. Common Shares,$25.03,0.32,1.295%,937331299.00,Bermuda,2014,368766,Finance,Property-Casualty Insurers
JSM,Navient Corporation 6% Senior Notes due December 15 2043,$23.28,0.12,0.518%,0.00,United States,,17100,Finance,Finance: Consumer Services
JSPR,Jasper Therapeutics Inc. Common Stock,$3.13,-0.22,-6.567%,118545467.00,United States,2020,29179,Health Care,Biotechnology: Pharmaceutical Preparations
JSPRW,Japer Therapeutics Inc. Warrants,$0.2328,-0.071,-23.371%,0.00,United States,2020,20629,Health Care,Biotechnology: Pharmaceutical Preparations
JUGG,Jaws Juggernaut Acquisition Corporation Class A Ordinary Share,$9.75,0.01,0.103%,336375000.00,United States,2021,611,,
JUGGU,Jaws Juggernaut Acquisition Corporation Unit,$9.86,0.00,0.00%,0.00,United States,2021,99,,
JUPW,Jupiter Wellness Inc. Common Stock,$1.03,-0.03,-2.83%,24432631.00,United States,2020,215637,Health Care,Biotechnology: Pharmaceutical Preparations
JUPWW,Jupiter Wellness Inc. Warrant,$0.7501,-0.0744,-9.024%,0.00,United States,2020,1970,Health Care,Biotechnology: Pharmaceutical Preparations
JVA,Coffee Holding Co. Inc. Common Stock,$3.35,-0.04,-1.18%,19123807.00,United States,2005,18532,Consumer Non-Durables,Specialty Foods
JWAC,Jupiter Wellness Acquisition Corp. Class A Common Stock,$10.00,0.00,0.00%,181550000.00,United States,2022,6,Consumer Durables,Consumer Electronics/Appliances
JWACR,Jupiter Wellness Acquisition Corp. Right,$0.19,-0.01,-5.00%,0.00,United States,2022,100,,
JWEL,Jowell Global Ltd. Ordinary Shares,$2.21,-0.03,-1.339%,56290587.00,China,2021,52773,Consumer Services,Other Consumer Services
JYAC,Jiya Acquisition Corp. Class A Common Stock,$9.8416,-0.0084,-0.085%,132340891.00,United States,2020,502,Consumer Durables,Consumer Electronics/Appliances
JYNT,The Joint Corp. Common Stock,$34.79,-0.03,-0.086%,501733030.00,United States,2014,400728,,
JZXN,Jiuzi Holdings Inc. Ordinary Shares,$1.29,-0.04,-3.008%,27640629.00,China,2021,98114,Consumer Durables,Automotive Aftermarket
KACL,Kairous Acquisition Corp. Limited Ordinary Shares,$9.91,-0.01,-0.101%,100548277.00,Malaysia,2022,2533,,
KACLR,Kairous Acquisition Corp. Limited Rights,$0.17,0.019,12.583%,0.00,Malaysia,2022,801,,
KACLU,Kairous Acquisition Corp. Limited Unit,$10.14,0.03,0.297%,0.00,Malaysia,2021,300,,
KACLW,Kairous Acquisition Corp. Limited Warrants,$0.15,-0.0049,-3.163%,0.00,Malaysia,2022,30300,,
KAII,Kismet Acquisition Two Corp. Class A Ordinary Shares,$9.77,-0.01,-0.102%,285772500.00,United States,2021,500,Finance,Business Services
KAIIU,Kismet Acquisition Two Corp. Unit,$9.83,-0.005,-0.051%,0.00,United States,2021,100,Finance,Business Services
KAIIW,Kismet Acquisition Two Corp. Warrant,$0.2768,0.00,0.00%,0.00,United States,2021,1,Finance,Business Services
KAIR,Kairos Acquisition Corp. Class A Ordinary Shares,$9.83,0.00,0.00%,339135000.00,United States,2021,1209,Finance,Business Services
KAIRU,Kairos Acquisition Corp. Unit,$9.90,0.02,0.202%,0.00,United States,2021,148,Finance,Business Services
KAIRW,Kairos Acquisition Corp. Warrant,$0.1612,-0.0283,-14.934%,0.00,United States,2021,150250,Finance,Business Services
KALA,Kala Pharmaceuticals Inc. Common Stock,$1.14,-0.08,-6.557%,63908246.00,United States,2017,1036178,Health Care,Biotechnology: Pharmaceutical Preparations
KALU,Kaiser Aluminum Corporation Common Stock,$91.64,0.28,0.306%,1453879414.00,United States,,78883,Basic Industries,Aluminum
KALV,KalVista Pharmaceuticals Inc. Common Stock,$14.70,-0.03,-0.204%,360785863.00,United Kingdom,2015,113891,Health Care,Biotechnology: Pharmaceutical Preparations
KARO,Karooooo Ltd. Ordinary Shares,$29.41,-0.435,-1.458%,910272027.00,Singapore,2021,5166,Technology,Computer Software: Prepackaged Software
KAVL,Kaival Brands Innovations Group Inc. Common Stock,$1.37,-0.07,-4.861%,42661000.00,United States,,198921,Consumer Non-Durables,Farming/Seeds/Milling
KBAL,Kimball International Inc. Class B Common Stock,$8.21,-0.10,-1.203%,300575234.00,United States,,217084,Consumer Durables,Industrial Specialties
KBNT,Kubient Inc. Common Stock,$1.45,-0.06,-3.974%,20666685.00,United States,2020,76055,Technology,EDP Services
KBNTW,Kubient Inc. Warrant,$0.42,0.05,13.514%,0.00,United States,2020,2370,Technology,EDP Services
KC,Kingsoft Cloud Holdings Limited American Depositary Shares,$6.00,-0.41,-6.396%,1458552732.00,China,2020,3143206,Technology,Computer Software: Prepackaged Software
KDNY,Chinook Therapeutics Inc. Common Stock,$16.00,0.59,3.829%,879217264.00,United States,2015,233965,Health Care,Biotechnology: Pharmaceutical Preparations
KDP,Keurig Dr Pepper Inc. Common Stock,$37.83,0.88,2.382%,53648930872.00,United States,,7593080,Consumer Non-Durables,Beverages (Production/Distribution)
KE,Kimball Electronics Inc. Common Stock,$18.57,-0.51,-2.673%,466268392.00,United States,,69082,Capital Goods,Industrial Machinery/Components
KELYA,Kelly Services Inc. Class A Common Stock,$20.85,-0.22,-1.044%,821486893.00,United States,,114776,Technology,Diversified Commercial Services
KELYB,Kelly Services Inc. Class B Common Stock,$20.80,-1.32,-5.967%,819516901.00,United States,,858,Technology,Diversified Commercial Services
KEQU,Kewaunee Scientific Corporation Common Stock,$14.36,0.15,1.056%,40062576.00,United States,,498,Capital Goods,Medical Specialities
KERN,Akerna Corp. Common Stock,$1.06,0.02,1.923%,14902229.00,United States,2018,1052813,Health Care,Managed Health Care
KERNW,Akerna Corp Warrant,$0.16,0.00,0.00%,0.00,United States,2018,23995,Health Care,Managed Health Care
KFFB,Kentucky First Federal Bancorp Common Stock,$7.38,0.00,0.00%,60650427.00,United States,,285,Finance,Savings Institutions
KFRC,Kforce Inc. Common Stock,$72.88,-1.37,-1.845%,1557578898.00,United States,1995,83174,Technology,Diversified Commercial Services
KHC,The Kraft Heinz Company Common Stock,$40.04,0.45,1.137%,49044761446.00,United States,,5481146,Consumer Non-Durables,Farming/Seeds/Milling
KIDS,OrthoPediatrics Corp. Common Stock,$55.12,-0.36,-0.649%,1088363582.00,United States,2017,71029,Health Care,Medical/Dental Instruments
KIII,Kismet Acquisition Three Corp. Class A Ordinary Shares,$9.80,0.00,0.00%,357087500.00,United States,2021,1390,Finance,Business Services
KIIIU,Kismet Acquisition Three Corp. Unit,$9.82,0.0012,0.012%,0.00,United States,2021,1000,Finance,Business Services
KIIIW,Kismet Acquisition Three Corp. Warrant,$0.18,-0.018,-9.091%,0.00,United States,2021,2700,Finance,Business Services
KINS,Kingstone Companies Inc. Common Stock,$4.91,-0.16,-3.156%,51472178.00,United States,,14347,Finance,Specialty Insurers
KINZ,KINS Technology Group Inc. Class A Common Stock,$10.06,-0.01,-0.099%,347070000.00,United States,2021,1318,Consumer Durables,Consumer Electronics/Appliances
KINZU,KINS Technology Group Inc. Unit,$10.01,0.00,0.00%,0.00,United States,2020,6,Consumer Durables,Consumer Electronics/Appliances
KINZW,KINS Technology Group Inc. Warrant,$0.1397,-0.0002,-0.143%,0.00,United States,2021,900,Consumer Durables,Consumer Electronics/Appliances
KIRK,Kirkland's Inc. COMMONSTOCK,$8.65,-0.58,-6.284%,106666152.00,United States,2002,339177,Miscellaneous,Diversified Commercial Services
KLAC,KLA Corporation Common Stock,$344.25,-1.27,-0.368%,51883756828.00,United States,1980,1780853,Capital Goods,Electronic Components
KLAQ,KL Acquisition Corp Class A Common Stock,$9.80,-0.03,-0.305%,352187500.00,United States,2021,205,Consumer Durables,Consumer Electronics/Appliances
KLAQU,KL Acquisition Corp Unit,$9.82,0.01,0.102%,0.00,United States,2021,200,Consumer Durables,Consumer Electronics/Appliances
KLAQW,KL Acquisition Corp Warrant,$0.22,-0.0118,-5.091%,0.00,United States,2021,34041,Consumer Durables,Consumer Electronics/Appliances
KLDO,Kaleido Biosciences Inc. Common Stock,$1.49,-0.02,-1.325%,63465582.00,United States,2019,58694,Health Care,Biotechnology: Biological Products (No Diagnostic Substances)
KLIC,Kulicke and Soffa Industries Inc. Common Stock,$52.06,-0.98,-1.848%,3243360282.00,Singapore,,987209,Technology,Semiconductors
KLTR,Kaltura Inc. Common Stock,$1.69,-0.06,-3.429%,214740205.00,United States,2021,447115,Technology,EDP Services
KLXE,KLX Energy Services Holdings Inc. Common Stock,$4.71,-0.27,-5.422%,49355558.00,United States,,341656,Energy,Oilfield Services/Equipment
KMDA,Kamada Ltd. Ordinary Shares,$5.72,0.04,0.704%,256258883.00,Israel,2013,8891,Health Care,Biotechnology: Pharmaceutical Preparations
KMPH,KemPharm Inc. Common Stock,$5.06,-0.14,-2.692%,177128538.00,United States,,461695,Health Care,Biotechnology: Pharmaceutical Preparations
KNBE,KnowBe4 Inc. Class A Common Stock,$23.75,0.12,0.508%,4149032423.00,United States,2021,633295,Technology,Computer Software: Prepackaged Software
KNDI,Kandi Technologies Group Inc Common Stock,$2.80,-0.19,-6.355%,213517766.00,China,,1409438,Capital Goods,Auto Parts:O.E.M.
KNSA,Kiniksa Pharmaceuticals Ltd. Class A Common Stock,$11.12,0.25,2.30%,768441139.00,United States,2018,122710,Health Care,Biotechnology: Pharmaceutical Preparations
KNTE,Kinnate Biopharma Inc. Common Stock,$10.60,-0.16,-1.487%,465862410.00,United States,2020,120302,Health Care,Biotechnology: Pharmaceutical Preparations
KNTK,Kinetik Holdings Inc. Class A Common Stock,$66.58,0.75,1.139%,1258126307.00,United States,2017,72637,Energy,Oil & Gas Production
KOD,Kodiak Sciences Inc Common Stock,$7.51,-0.03,-0.398%,390028095.00,United States,2018,755045,Health Care,Biotechnology: Pharmaceutical Preparations
KOPN,Kopin Corporation Common Stock,$2.35,-0.15,-6.00%,216765271.00,United States,1992,750962,Capital Goods,Industrial Machinery/Components
KOSS,Koss Corporation Common Stock,$7.92,-0.26,-3.178%,72450536.00,United States,,158815,Consumer Non-Durables,Consumer Electronics/Appliances
KPLT,Katapult Holdings Inc. Common Stock,$2.21,-0.06,-2.643%,216259252.00,United States,2019,633448,Technology,Diversified Commercial Services
KPLTW,Katapult Holdings Inc. Warrant,$0.32,-0.01,-3.03%,0.00,United States,2019,15580,Technology,EDP Services
KPRX,Kiora Pharmaceuticals Inc.  Common Stock,$0.616,-0.008,-1.282%,7794281.00,United States,,122604,Health Care,Biotechnology: In Vitro & In Vivo Diagnostic Substances
KPTI,Karyopharm Therapeutics Inc. Common Stock,$8.34,0.22,2.709%,660194533.00,United States,2013,2567287,Miscellaneous,Diversified Commercial Services
KRBP,Kiromic BioPharma Inc. Common Stock,$0.7928,-0.0655,-7.631%,12356253.00,United States,2020,34284,Consumer Durables,Specialty Chemicals
KRKR,36Kr Holdings Inc. American Depositary Shares,$1.095,-0.055,-4.783%,42217498.00,China,2019,18764,Miscellaneous,Business Services
KRMD,Repro Med Systems Inc. Common Stock,$2.99,0.01,0.336%,133566768.00,United States,,16738,Health Care,Medical/Dental Instruments
KRNL,Kernel Group Holdings Inc. Class A Ordinary Shares,$9.81,0.01,0.102%,373699688.00,United States,2021,5027,Finance,Business Services
KRNLU,Kernel Group Holdings Inc. Units,$9.9097,0.00,0.00%,0.00,United States,2021,307,Finance,Business Services
KRNLW,Kernel Group Holdings Inc. Warrants,$0.3399,0.1037,43.903%,0.00,United States,2021,105,Finance,Business Services
KRNT,Kornit Digital Ltd. Ordinary Shares,$79.65,-5.61,-6.58%,3957374726.00,Israel,2015,551636,Capital Goods,Industrial Machinery/Components
KRNY,Kearny Financial Corp Common Stock,$12.47,-0.08,-0.637%,907230409.00,United States,,364063,Finance,Savings Institutions
KRON,Kronos Bio Inc. Common Stock,$7.29,0.04,0.552%,412628325.00,United States,2020,367106,Consumer Durables,Specialty Chemicals
KROS,Keros Therapeutics Inc. Common Stock,$66.35,3.08,4.868%,1592430057.00,United States,2020,168514,Consumer Durables,Specialty Chemicals
KRT,Karat Packaging Inc. Common Stock,$18.25,-0.35,-1.882%,361430610.00,United States,2021,16312,Capital Goods,Office Equipment/Supplies/Services
KRTX,Karuna Therapeutics Inc. Common Stock,$140.02,1.99,1.442%,4173755506.00,United States,2019,260513,Health Care,Biotechnology: Pharmaceutical Preparations
KRUS,Kura Sushi USA Inc. Class A Common Stock,$54.69,-1.98,-3.494%,531131178.00,United States,2019,82296,Consumer Services,Restaurants
KRYS,Krystal Biotech Inc. Common Stock,$70.70,-0.33,-0.465%,1782211610.00,United States,2017,156902,Health Care,Biotechnology: Biological Products (No Diagnostic Substances)
KSCP,Knightscope Inc. Class A Common Stock,$4.41,-0.42,-8.696%,104587992.00,United States,2022,728827,Miscellaneous,Diversified Manufacture
KSI,Kadem Sustainable Impact Corporation Class A common stock,$9.7572,-0.0028,-0.029%,213438750.00,United States,2021,337,Consumer Durables,Consumer Electronics/Appliances
KSICU,Kadem Sustainable Impact Corporation Unit,$9.87,0.01,0.101%,0.00,United States,2021,100,Consumer Durables,Consumer Electronics/Appliances
KSICW,Kadem Sustainable Impact Corporation Warrant,$0.1746,0.0022,1.276%,0.00,United States,2021,1400,Consumer Durables,Consumer Electronics/Appliances
KSPN,Kaspien Holdings Inc. Common Stock,$8.69,-0.81,-8.526%,21660416.00,United States,,58891,Technology,Retail: Computer Software & Peripheral Equipment
KTCC,Key Tronic Corporation Common Stock,$5.63,0.02,0.357%,60589334.00,United States,1983,7209,Technology,Computer peripheral equipment
KTOS,Kratos Defense & Security Solutions Inc. Common Stock,$20.70,-0.44,-2.081%,2580112998.00,United States,,963847,Consumer Non-Durables,Ordnance And Accessories
KTRA,Kintara Therapeutics Inc. Common Stock,$0.385,-0.0104,-2.63%,18887049.00,United States,,175588,Health Care,Biotechnology: Pharmaceutical Preparations
KTTA,Pasithea Therapeutics Corp. Common Stock,$1.21,-0.03,-2.419%,27658629.00,United States,2021,195132,Health Care,Biotechnology: Pharmaceutical Preparations
KTTAW,Pasithea Therapeutics Corp. Warrant,$0.151,0.0011,0.734%,0.00,United States,2021,3475,Health Care,Biotechnology: Pharmaceutical Preparations
KURA,Kura Oncology Inc. Common Stock,$16.67,0.32,1.957%,1110460031.00,United States,,384710,Health Care,Biotechnology: Biological Products (No Diagnostic Substances)
KVHI,KVH Industries Inc. Common Stock,$9.005,-0.115,-1.261%,169984368.00,United States,1996,36776,Technology,Radio And Television Broadcasting And Communications Equipment
KVSA,Khosla Ventures Acquisition Co. Class A Common Stock,$9.775,-0.005,-0.051%,395789750.00,United States,2021,23977,Consumer Durables,Consumer Electronics/Appliances
KVSC,Khosla Ventures Acquisition Co. III Class A Common Stock,$9.77,0.0001,0.001%,661984200.00,United States,2021,1667436,Consumer Durables,Consumer Electronics/Appliances
KXIN,Kaixin Auto Holdings Ordinary Shares,$1.09,0.02,1.869%,156371940.00,China,2017,388649,Finance,Business Services
